benchmark_results.csv

db,query,mean_ms,stdev_ms
MongoDB,point_lookup,0.63,0.06
MongoDB,filtered_scan_EN_affiliates,0.57,0.02
MongoDB,avg_views_by_language,65.85,1.75
MongoDB,top10_by_views,0.62,0.09
MongoDB,1hop_neighbors,0.55,0.03
MongoDB,shortest_indirect_path,851.86,10.8
ScyllaDB,point_lookup,15.5,0.54
ScyllaDB,filtered_scan_EN_affiliates,403.52,17.4
ScyllaDB,1hop_neighbors,15.65,0.4
Neo4j,point_lookup,1.95,0.18
Neo4j,filtered_scan_EN_affiliates,19.21,0.61
Neo4j,avg_views_by_language,40.93,6.11
Neo4j,top10_by_views,18.46,1.77
Neo4j,1hop_neighbors,1.99,0.14
Neo4j,2hop_neighbors,710.52,10.69
Neo4j,shortest_path,1.89,0.25
Neo4j,shortest_indirect_path,1.93,0.39
PostgreSQL,point_lookup,0.33,0.13
PostgreSQL,filtered_scan_EN_affiliates,5.68,0.17
PostgreSQL,avg_views_by_language,7.78,0.16
PostgreSQL,top10_by_views,6.7,0.19
PostgreSQL,1hop_neighbors,79.23,2.42
PostgreSQL,2hop_neighbors,506.01,13.89
PostgreSQL,shortest_indirect_path,0.4,0.08

PlanoExperimental.md

## Resultados

Por consulta:
Banco de dados (Tempo médio +/- desvio-padrão) (em ms)
1. Retornar uma conta:
    1. PostgreSQL (0.33 +/- 0.13)
    2. MongoDB (0.63 +/- 0.06)
    3. Neo4J (1.95 +/- 0.18)
    4. ScyllaDB (15.5 +/- 0.54)
2. Retornar todos os afiliados da língua inglesa:
    1. MongoDB (0.57 +/- 0.02)
    2. PostgreSQL (5.68 +/- 0.17)
    3. Neo4J (19.21 +/- 0.61)
    4. ScyllaDB (403.52 +/- 17.4)
3. Retornar views médias por língua:
    1. PostgreSQL (7.78 +/- 0.16)
    2. Neo4J (40.93 +/- 6.11)
    3. MongoDB (65.85 +/- 1.75)
    4. ScyllaDB (incapaz por conta própria)
4. Retornar top 10 contas por views:
    1. MongoDB (0.62 +/- 0.09)
    2. PostgreSQL (6.7 +/- 0.19)
    3. Neo4J (18.46 +/- 1.77)
    4. ScyllaDB (incapaz sem índices secundários)
5. Retornar todos os vizinhos diretos:
    1. MongoDB (0.55 +/- 0.03)
    2. Neo4J (1.99 +/- 0.14)
    3. ScyllaDB (15.65 +/- 0.4)
    4. PostgreSQL (79.23 +/- 2.42)
6. Retornar todos os vizinhos de segundo grau:
    1. PostgreSQL (506.01 +/- 13.89)
    2. Neo4J (710.52 +/- 10.69)
    3. ScyllaDB e MongoDB (não foram capazes)
7. Retornar o menor caminho indireto entre dois usuários:
    1. PostgreSQL (0.4 +/- 0.4)
    2. Neo4J (1.93 +/- 0.39)
    3. MongoDB (851.86 +/- 10.8)
    4. ScyllaDB (não foi capaz)
8. Retornar o menor caminho entre dois usuários:
    1. Neo4J (1.89 +/- 0.25)